{
  "$schema": "https://schemas.luh.tech/deliverable.schema.json",
  "id": "d-2026-06-26-eb-stage5-takt-keyset-batch",
  "version": "1.0.0",
  "title": "Stage-5 keyset-batched takt UPDATE",
  "description": "Stage-5 contract-takt write bounded via keyset-batched UPDATE (<=5000-row statements on uuid PK), bounding the consumed canonical status write required by voxel.schema.json. No statement_timeout bump.",
  "authority": {
    "author": "Claude (EB-chat), L1",
    "approver": "Erik Luhtala (L4)",
    "revertAuthority": "Erik Luhtala (L4)"
  },
  "lifecycleState": "S8-closed",
  "scope": {
    "repo": "luh-tech/Ectropy-Business",
    "branch": "fix/intake-provision-scaling-2026-06-26",
    "scopeFiles": [
      "apps/api-gateway/src/intake/stages/stage-5-contract-takt.ts",
      "apps/api-gateway/src/intake/__tests__/stage-5-contract-takt.spec.ts",
      "apps/api-gateway/src/intake/intake-pipeline.ts"
    ]
  },
  "outputs": [
    {
      "id": "OUT-1",
      "description": "Keyset-batched takt UPDATE in stage-5-contract-takt.ts",
      "acceptanceCriteria": [
        "<=5000-row UPDATE statements on uuid PK",
        "no statement_timeout bump",
        "unit spec green"
      ]
    }
  ],
  "validation": {
    "preMerge": [
      "TypeScript build passes",
      "unit specs green",
      "demo provision completes without 57014"
    ],
    "postMerge": [
      "Maple Ridge demo provision GREEN (voxel_groups=21, voxels=859838)"
    ]
  },
  "transitions": [
    {
      "from": "",
      "to": "S4-authored",
      "date": "2026-06-26",
      "trigger": "L4 approval (intake-scaling arc)"
    },
    {
      "from": "S4-authored",
      "to": "S7-merged",
      "date": "2026-06-26",
      "commitSha": "b492888d758ad63794a781fb3bddc75f0eba8b73",
      "prUrl": "https://github.com/luh-tech/Ectropy-Business/pull/552",
      "trigger": "EB PR #552 squash-merged to luh-tech/Ectropy-Business main (2026-06-26T16:34:41Z)"
    },
    {
      "from": "S7-merged",
      "to": "S8-closed",
      "date": "2026-06-29",
      "trigger": "TRUTH-DELIVERED authored by SR-CLI; closed-clean"
    }
  ],
  "notes": "Part of the intake-scaling arc (EB PR #552). Sibling DEC: d-2026-06-26-eb-coord-viewer-render-scaling."
}
